[
  {
    "collected_at": 10.018033,
    "content_hash": "3b663cd81a3a3effdc48e633a51f1ac3675ffabeda5dcca218e6127ada5831e6",
    "custody_status": "verified",
    "evidence_id": "UC1-EV-000001",
    "evidence_type": "message_observation",
    "fields": {
      "event_id": "UC1-EVT-000001",
      "event_time": 10.0,
      "event_type": "message_observation",
      "ingest_time": 10.018033,
      "message_id": "UC1-MSG-000001",
      "payload_hash": "19e628a3db46b7a0ef01618652b3eef9d0a832d11d8be3371d7802d5db2f9493",
      "source_entity": "UC1-D02",
      "target_entity": "UC1-D05"
    },
    "source_event_id": "UC1-EVT-000001"
  },
  {
    "collected_at": 10.019033,
    "content_hash": "1a07cdef03f822ce706f5baa509c30ff9b5d91f4d381582993ba5af61a375c7b",
    "custody_status": "verified",
    "evidence_id": "UC1-EV-000002",
    "evidence_type": "trust_decision",
    "fields": {
      "event_id": "UC1-EVT-000002",
      "event_time": 10.018033,
      "event_type": "trust_decision",
      "ingest_time": 10.019033,
      "message_id": "UC1-MSG-000001",
      "payload_hash": "bf429670e7e87812b3e488fba28ed138e13c01b1e91cd3659dbb2351f97b7c5a",
      "source_entity": "UC1-S02",
      "target_entity": "UC1-D05"
    },
    "source_event_id": "UC1-EVT-000002"
  },
  {
    "collected_at": 10.029033,
    "content_hash": "c0533033d327c96c1b20b27d01cb3c928a54d0931504f27c6164432c41a3d718",
    "custody_status": "verified",
    "evidence_id": "UC1-EV-000003",
    "evidence_type": "controller_decision",
    "fields": {
      "event_id": "UC1-EVT-000003",
      "event_time": 10.028033,
      "event_type": "controller_decision",
      "ingest_time": 10.029033,
      "message_id": "UC1-MSG-000001",
      "payload_hash": "532fbec8fe82b78b0cf9aca7b1ac7370acf32e50e3f972b977528fa3e566301c",
      "source_entity": "UC1-D06",
      "target_entity": "UC1-D07"
    },
    "source_event_id": "UC1-EVT-000003"
  },
  {
    "collected_at": 20.023058,
    "content_hash": "48bbd34ceef19bb0d3a02d6905f8966b6fc4a385be52abcba17446a9ec9658b1",
    "custody_status": "verified",
    "evidence_id": "UC1-EV-000004",
    "evidence_type": "message_observation",
    "fields": {
      "event_id": "UC1-EVT-000004",
      "event_time": 20.0,
      "event_type": "message_observation",
      "ingest_time": 20.023058,
      "message_id": "UC1-MSG-000004",
      "payload_hash": "c11cd4adb45233001708b3cd809bd8f211b9fef3c05f4ce26a5cf9bea6799768",
      "source_entity": "UC1-D02",
      "target_entity": "UC1-D05"
    },
    "source_event_id": "UC1-EVT-000004"
  },
  {
    "collected_at": 20.024058,
    "content_hash": "1912c95468e43a69ed64d3169954bcbc053b279a0e63381ee29eb3f8f7f797a7",
    "custody_status": "verified",
    "evidence_id": "UC1-EV-000005",
    "evidence_type": "trust_decision",
    "fields": {
      "event_id": "UC1-EVT-000005",
      "event_time": 20.023058,
      "event_type": "trust_decision",
      "ingest_time": 20.024058,
      "message_id": "UC1-MSG-000004",
      "payload_hash": "b19eb8b12eb0bc86b785e79eda93739ff8129b5b303df08fe6439a06aa9b4026",
      "source_entity": "UC1-S02",
      "target_entity": "UC1-D05"
    },
    "source_event_id": "UC1-EVT-000005"
  },
  {
    "collected_at": 20.034058,
    "content_hash": "a0a0f09cdaac1af4c277ff2a8866d16a943443b152ebffac71cdd5499d9dab9b",
    "custody_status": "verified",
    "evidence_id": "UC1-EV-000006",
    "evidence_type": "controller_decision",
    "fields": {
      "event_id": "UC1-EVT-000006",
      "event_time": 20.033058,
      "event_type": "controller_decision",
      "ingest_time": 20.034058,
      "message_id": "UC1-MSG-000004",
      "payload_hash": "fda7afa4372b853d1f353392137534da68f8b0631ea1d9e989ff775f44df532c",
      "source_entity": "UC1-D06",
      "target_entity": "UC1-D07"
    },
    "source_event_id": "UC1-EVT-000006"
  },
  {
    "collected_at": 30.023627,
    "content_hash": "23a41bac943450c228bd8e7b3099359397e19066d90926b4f34d610a36bb5a53",
    "custody_status": "verified",
    "evidence_id": "UC1-EV-000007",
    "evidence_type": "message_observation",
    "fields": {
      "event_id": "UC1-EVT-000007",
      "event_time": 30.0,
      "event_type": "message_observation",
      "ingest_time": 30.023627,
      "message_id": "UC1-MSG-000007",
      "payload_hash": "61e738606fef83e1f5dba0120dbb19580a9f425df6e44d99ff13c331b2a186f1",
      "source_entity": "UC1-D02",
      "target_entity": "UC1-D05"
    },
    "source_event_id": "UC1-EVT-000007"
  },
  {
    "collected_at": 30.024627,
    "content_hash": "0aa0d664cfbf684ab9e2d2836eee52b482deca52b152812ceeffac8c678250bf",
    "custody_status": "verified",
    "evidence_id": "UC1-EV-000008",
    "evidence_type": "trust_decision",
    "fields": {
      "event_id": "UC1-EVT-000008",
      "event_time": 30.023627,
      "event_type": "trust_decision",
      "ingest_time": 30.024627,
      "message_id": "UC1-MSG-000007",
      "payload_hash": "31473a05e7c4cb9df4c12379a1c8140988ee59c0b0628bbe1ba8aa42e25de6a9",
      "source_entity": "UC1-S02",
      "target_entity": "UC1-D05"
    },
    "source_event_id": "UC1-EVT-000008"
  },
  {
    "collected_at": 30.034627,
    "content_hash": "1332483170cd30c950bd51a347e5e32f6d676735cd255f0b9783714b79fead33",
    "custody_status": "verified",
    "evidence_id": "UC1-EV-000009",
    "evidence_type": "controller_decision",
    "fields": {
      "event_id": "UC1-EVT-000009",
      "event_time": 30.033627,
      "event_type": "controller_decision",
      "ingest_time": 30.034627,
      "message_id": "UC1-MSG-000007",
      "payload_hash": "38c38d3515e10e5edf6b6f7b74bead8f4fb36ff73205b80abe4287fcc5c63447",
      "source_entity": "UC1-D06",
      "target_entity": "UC1-D07"
    },
    "source_event_id": "UC1-EVT-000009"
  },
  {
    "collected_at": 45.024724,
    "content_hash": "5c5bbd8c2d005e0e70f1b45cef650256d6607815cd967c48c0bc6772cf9f11a7",
    "custody_status": "verified",
    "evidence_id": "UC1-EV-000010",
    "evidence_type": "message_observation",
    "fields": {
      "event_id": "UC1-EVT-000010",
      "event_time": 45.0,
      "event_type": "message_observation",
      "ingest_time": 45.024724,
      "message_id": "UC1-MSG-000010",
      "payload_hash": "f650bb1f2acf9410d931ff3a756142c4e2d70374c03e4dd5d1babf2db69376c2",
      "source_entity": "UC1-D08",
      "target_entity": "UC1-D05"
    },
    "source_event_id": "UC1-EVT-000010"
  },
  {
    "collected_at": 45.025724,
    "content_hash": "5058581bac6ccff35e0f5f389fd1c4867a5dd865bb780fc4e52703fea9ddab81",
    "custody_status": "verified",
    "evidence_id": "UC1-EV-000011",
    "evidence_type": "trust_decision",
    "fields": {
      "event_id": "UC1-EVT-000011",
      "event_time": 45.024724,
      "event_type": "trust_decision",
      "ingest_time": 45.025724,
      "message_id": "UC1-MSG-000010",
      "payload_hash": "43a9142ded75061044a46d796f7cd66f5239b545d1be460355a2cb41dfd85360",
      "source_entity": "UC1-S02",
      "target_entity": "UC1-D05"
    },
    "source_event_id": "UC1-EVT-000011"
  },
  {
    "collected_at": 45.026724,
    "content_hash": "19bc3202da2503f9f08b7374da9cdbc0760b58bac12b6373cfe9d81c82422aa4",
    "custody_status": "verified",
    "evidence_id": "UC1-EV-000012",
    "evidence_type": "alert",
    "fields": {
      "event_id": "UC1-EVT-000012",
      "event_time": 45.025724,
      "event_type": "alert",
      "ingest_time": 45.026724,
      "message_id": "UC1-MSG-000010",
      "payload_hash": "d62fd74bd7fe7f2a41345e6e9d4cd58fbbd9a69f78644e0c20e17d5c9ba07077",
      "source_entity": "UC1-S03",
      "target_entity": "UC1-S04"
    },
    "source_event_id": "UC1-EVT-000012"
  },
  {
    "collected_at": 45.076724,
    "content_hash": "6f56cc347616c3a25dbabcab26295f75fde1d3adadc3933194846ea0eb6b9877",
    "custody_status": "verified",
    "evidence_id": "UC1-EV-000013",
    "evidence_type": "policy_decision",
    "fields": {
      "event_id": "UC1-EVT-000013",
      "event_time": 45.026724,
      "event_type": "policy_decision",
      "ingest_time": 45.076724,
      "message_id": "UC1-MSG-000010",
      "payload_hash": "71d997280358965b7ab66d08b9230ab3c451c472f1e58a5c271a256d9c7b33f5",
      "source_entity": "UC1-S04",
      "target_entity": "UC1-D05"
    },
    "source_event_id": "UC1-EVT-000013"
  },
  {
    "collected_at": 45.035724,
    "content_hash": "2616cfbb0c2cba1e3410039f5d0594e68641e22c3930e8420a92d9d1edb6406a",
    "custody_status": "verified",
    "evidence_id": "UC1-EV-000014",
    "evidence_type": "controller_decision",
    "fields": {
      "event_id": "UC1-EVT-000014",
      "event_time": 45.034724,
      "event_type": "controller_decision",
      "ingest_time": 45.035724,
      "message_id": "UC1-MSG-000010",
      "payload_hash": "0a5b38928baf8730bb680b931dc14c20f8f07837553e1e29b126b1ae8677f618",
      "source_entity": "UC1-D06",
      "target_entity": "UC1-D07"
    },
    "source_event_id": "UC1-EVT-000014"
  },
  {
    "collected_at": 45.122651,
    "content_hash": "aeaceab00f5d89fc3c978ea1ac806af6e57167c3720fa4e901a98fb56d17d868",
    "custody_status": "verified",
    "evidence_id": "UC1-EV-000015",
    "evidence_type": "message_observation",
    "fields": {
      "event_id": "UC1-EVT-000015",
      "event_time": 45.1,
      "event_type": "message_observation",
      "ingest_time": 45.122651,
      "message_id": "UC1-MSG-000015",
      "payload_hash": "9ee32929e803871afe158d99bd684dbfabd46cfd88b886821859fca1f2392110",
      "source_entity": "UC1-D08",
      "target_entity": "UC1-D05"
    },
    "source_event_id": "UC1-EVT-000015"
  },
  {
    "collected_at": 45.123651,
    "content_hash": "b37bf29ad96e8b61231b0e808282fd82bafe739395f2c3476772d1ca9a5138e7",
    "custody_status": "verified",
    "evidence_id": "UC1-EV-000016",
    "evidence_type": "trust_decision",
    "fields": {
      "event_id": "UC1-EVT-000016",
      "event_time": 45.122651,
      "event_type": "trust_decision",
      "ingest_time": 45.123651,
      "message_id": "UC1-MSG-000015",